text	label
Eight o'clock in the morning And I'm moving on out to school With an open book and a sleepy look The teacher can't be fooled I catch a pass in an early class The teacher will never know That I postponed my work at home Watching the evening show Hey, there Anthony boy Why you in such a rush? The girl she wanna talk to you Look at him he's a blush Three o'clock in the afternoon Completes a day of school Before the ding can cease the ring He's in the vestibule Betty and Barbara and Jeanie and Jane Are yackity-yacking with Joan About some things that Anthony Told her over the telephone You might also like Hey, there Tony me boy Why you in such a rush? The girl she wanna talk to you Look at him he's a blush Hey, there Anthony boy Why you in such a rush? The girl she wanna talk to you Look at him how he blush Betty told me the secret That I had told her not to tell Now that you know she knows I know You know that all is well Come, come Tony me boy Now don't let 'em get in your hair With a good education you may Become a multi-millionaire Hey, there Anthony boy Why you in such a rush? The girl she wanna talk to you Look at him he's a blushEmbed	4
If I were a pendulum swing and you were the bird in the cuckoo clock Ev'ry time you cucko-cooed I would double tick another tick tock I'd double my swing ev'ry time you'd sing we'd make good time with each other Oh, but that would be just so much fun cooin' and swingin' together If I were a little bitty boy and I had just a little bit o' credit I would make a loan for an ice cream cone and I'd go right away and get it You would lick a little and I would lick a little, we surely could lick with each other Oh, but that would be just so much fun, eating it all together And if I were a little honey bee and you were a little butterfly I would be waiting at the garden gate until you came fluttering by Maybe you'd stop on a red rose top and then we could talk to each other Oh, but we cou'd flutter up so much fun being in the garden together But I'm just an ordinary guy and I love all the things you do You seem such a talented, beautiful girl and I'm afraid to even talk to you If I were as bold like some guys, hearin' them talk to each other I'd come over and ask you if we could go out together But if you were a Mercedes-Benz, I'd have to be a Fleetwood Brougham And ev'ry time I saw you rollin' on the freeway I think I'd have to follow you home You could let me lodge in your double garage, bumper to bumper out of the weather Nobody home but the Benz and the Brougham, really rarin' to roll off togetherYou might also likeEmbed	4
[Verse ] As I got on a city bus and found a vacant seat I thought I saw my future bride walkin' up the street I shouted to the driver, "Hey conductor, you must slow down I think I see her please let me off this bus" [Chorus] Nadine, honey, is that you? Oh, Nadine, honey, is that you? Seems like every time I see you, darling, you got something else to do [Verse ] I saw her from the corner when she turned and doubled back And started walkin toward a coffee colored Cadillac I was pushin through the crowd to get to where she's at And I was campaign shouting like a southern diplomat [Chorus] Nadine, honey, is that you? Oh, Nadine, honey, where are you? Seems like every time I catch up with you, you're up to something new [Verse ] Downtown searching for her, looking all around Saw her getting in a yellow cab heading uptown I caught a loaded taxi, paid up everybody's tab With a twenty-dollar bill and told him, "Catch that yellow cab" You might also like[Chorus] Nadine, honey, is that you? Oh, Nadine, honey, is that you? Seems like every time I catch up with you, you're up to something new [Verse ] She moves around like a wayward summer breeze "Go, driver, go, go, catch her, pretty please" Moving through the traffic like a mounted cavalier Leaning out the taxi window trying to make her hear [Chorus] Nadine, honey, is that you? Oh, Nadine, honey, is that you? Seems like every time I see you, darling, you're up to something newEmbed	4
[Verse ] A stranger lying on a bar room floor Had drank so much he could drink no more So he fell asleep with a troubled brain To dream that he rode on that downbound train [Verse ] The engine with blood was sweaty and damp And brilliantly lit with a brimstone lamp And imps for fuel was shoveling bones While the furnace rang with a thousand groans [Verse ] The boiler was filled with lager beer The devil himself was the engineer The passengers were most a motley crew Some were foreigners and others he knew Rich men in broadcloth, beggars in rags Handsome young ladies and wicked old hags [Verse ] As the train rushed on at a terrible pace Sulphuric fumes scorched their hands and face Wider and wider the country grew Faster and faster the engine flew Louder and louder the thunder crashed Brighter and brighter the lightning flashed Hotter and hotter the air became Till their clothes were burned and they were screaming with pain Then out of the distance, there came a yell "Ha ha", said the devil, "We're nearing home" Oh how the passengers shrieked with pain And begged old Satan to stop that train You might also like[Verse ] The stranger awoke with an anguished cry His clothes wet with sweat and his hair standing high He fell on his knees on the bar room floor And prayed a prayer like never before And the prayers and vows were not in vain For he never rode that downbound trainEmbed	4
Casey is an old man who wants to be a teen He goes to all the dances and they call him cha-cha King He cha-cha's when the band is playing rock and roll He tries to keep in time but the beat leaves him cold Because he's too pooped to pop, too old a soul Hips getting weaker when he tries to do this stroll And every time his feet get to go in one way Here comes a new dance and it's going to stray Chicks told Casey, you better move man This is only a one night stand Casey wasn't in time but he was dancing awhile Till a cramp caught his leg and he had to change his style Because he's too pooped to pop, too old a soul Hips getting weaker when he tries to do this stroll And every time his feet get to go in one way Here comes a new dance and it's going to stray Because he's too pooped to pop, too old a soul Hips getting weaker when he tries to do this stroll And every time his feet get to go in one way Here comes a new dance and it's going to stray You might also like Casey finally learned to do the hoochie koo This might have been fine back in ' Now, I'm going to give you fellows just a little tip If you want to keep your girl you'll better get hip Or, you'll be too pooped to pop, too old a soul You hips are getting weaker when you'll try to do the stroll And every time your feet getting to go in one way Here comes a new dance you'll be left to strayEmbed	4
My dear, my dear She told me one day That I'd meet my true love And take her away She said I'd be happy And to be good and true I'd never be lonely, brokenhearted or blue My dear, my dear, just like you said I met my true love one, and we are to wed My dear, she's an angel and I'm going to be true Or else I may lose her I don't wanna lose her to somebody new My dear, my dear, I was not untrue I tried hard to please her But she's gone and I'm blue My dear, I'm so lonesome, brokenhearted, too My dear, my dear, oh, my dear, what must I do?You might also likeEmbed	4
Deep down in Louisiana close to New Orleans Way back up in the woods among the evergreens There stood a log cabin made of earth and wood Where lived a country boy named Johnny B. Goode Who never ever learned to read or write so well But he could play a guitar just like a ringin' a bell Go, go Go, Johnny, go, go Go, Johnny, go, go Go, Johnny, go, go Go, Johnny, go, go Johnny B. Goode He used to carry his guitar in a gunny sack Go sit beneath the tree by the railroad track Oh, the engineers would see him sitting in the shade Strummin' with the rhythm that the drivers made People passing by, they would stop and say "Oh, my, but that little country boy could play" Go, go Go, Johnny, go, go Go, Johnny, go, go Go, Johnny, go, go Go, Johnny, go, go Johnny B. Goode You might also like His mother told him, "Someday you will be a man And you will be the leader of a big ol' band Many people coming from miles around To hear you play your music when the sun go down Maybe someday your name will be in lights Sayin' 'Johnny B. Goode Tonight'" Go, go Go, Johnny, go Go, go, go, Johnny, go Go, go, go, Johnny, go Go, go, go, Johnny, go Go, Johnny B. GoodeEmbed	4
I guess I'll go to California Seems like I'm always on the run Nobody ever needs a loser We just exist under the sun But someday, somehow, someone may need me When my drifting days are done Well, I'm aimlessly drifting Looks like I live from day to day Hard as I try to make a showing Something is always in my way Even the one I truly love now Deals in the games that people play Every time I love I always lose Seems like I'll never ever win Each I hear them lonesome blues I'm all alone at home again Seems like I'm just existing Aimlessly drifting to no end All that I ask of this old world Is just to have a happy home All that I ask of one little girl Is just to be my very own It seems just like I'm just existing Aimlessly drifting along You might also like Yes, I'll go to California Seems like I'm always on the run Nobody ever needs a loser I just exist under the sun But someday, somehow, someone may need me But my drifting days be doneEmbed	4
My babe don't stand no cheating, my babe My babe, true little baby, my babe My babe don't stand no cheating She don't stand none of that midnight creeping My babe, true little baby, my babe My babe, she loves me steady, my babe My babe, a grooving little babe, my babe My baby loves me steady My babe, she always ready My babe, a grooving little babe, my babe My baby don't stand no cheating, my babe Oh no, she don't stand no cheating, my babe Oh no, she don't stand no cheating Everything she do she do so pleasing My babe, true little baby, my babe My babe don't me no fooling, my babe My babe, she don't stand no fooling, my babe Oh yeah, she don't stand no fooling When she's hot, she tells me to cool her My babe, my babeYou might also likeEmbed	4
So long I hope we'll meet again someday And I hope that, maybe you will say Oh darling, I was wrong So long Gee, I hate to see you go You’re the world to me, you know You've been mine, so long All along In my memories of you I can see that you're lonely too But you’re my own Even though we're far apart You will be, you will be right here in my heart So long So long Though you leave me here to cry This could never mean goodbye You've been mine, so longYou might also likeEmbed	4
Fish and chips A little coke and you, oh, babe Honey drips Two more to go, oh, babe Let's go on back The trip will be groovy, oh, babe Jump in the sack And flip your mood, oh, babe Come to me I really do love you, oh, babe Honey, honey Honey dripper too, oh, babe Loved you before I loved you a long time, my love Loving you more And then I got to have more of Fish and chips A little coke and you, oh, babe Honey drips Two more to go, oh, babe Let's go on back The trip will be groovy, oh, babe Jump in the sack Flip your mood, oh, babe You might also like Fish and chips A little coke and you, oh, babe Honey drips Two more to go, oh, babe Let's go on back The trip will be groovy, oh, babe Jump in the sack Flip your mood, oh, babeEmbed	4
I got lumps in my throat When I saw her comin' down the aisle I got the wiggles in my knees When she looked at me and sweetly smiled There she is again Standing over by the record machine Lookin' like a model on the cover of a magazine She's too cute to be a minute over seventeen Meanwhile I was thinking... Well if she's in the mood No need to break it I got the chance, and I oughta take it If she'll dance, then we can make it Come on queenie, let's shake it Go, go, go, little queenie Go, go, go, little queenie Go, go, go, little queenie Tell me, who's the queen Standing over by the record machine Lookin' like a model on the cover of a magazine She's too cute to be a minute over seventeen You might also like Meanwhile, I was still thinkin ... If it's a slow song, we'll omit it If it's a rocker, that'll get it And if it's good, she'll admit it C'mon queenie, let's get with it Go, go, go, little queenie Go, go, go, little queenie Go, go, go, little queenie Embed	4
Things that I used to do Some I won't do no more Things that I used to do Some I won't do no more Used to sit and hold your hand, baby Begging you, not today Used to search all night for you baby And I search always anything Used to search all night for you baby And I search always anything Yeah, and I'm new alone again, darlin' You was out somewhere with your other man I'm gonna send you back to your mother, baby Or I'm gonna back to my family too I'm gonna send you back to your mother, baby Or I'm gonna back to my family too Nothing I ever do pleases you, darlin' Or I just can't get along with youYou might also likeEmbed	4
Oh lordy Lord, oh lordy Lord It hurts me so bad for us to part But someday, baby, I am not going to worry my life anymore So many nights since you've been gone I've had to worry my life along But someday, baby, I am not going to worry my life anymore How many times, how many times since you went away Have I set and cried and cried both night and day Someday, baby, I am not going to worry my life anymore You're on my mind, baby, every place I go How much I love you, nobody knows But someday, baby, I am not going to worry my life anymore You might also like So that's my story, baby, this is all I got to say to you Bye-bye, baby, I don't care what you do But someday, baby, I am not going to worry my life anymoreEmbed	4
At nine years old and sweet as she can be All dressed up like a downtown Christmas tree Dancing and humming a rock-roll melody Shes the daughter of a well-respected man Who taught her how to judge and understand Since she became a rock-roll music fan Sweet little rock and roller Sweet little rock and roller Her daddy don't have to scold her Her partner can't hardly hold her She never gets any older Sweet little rock and roller Should've seen her eyes when the band began to play And the famous singers sang and barred away When the stars performed, she screamed and yelled, "Hooray!" Ten thousand eyes were watching them leave the floor Five thousand tongues were screaming, "More! More!" And about fifteen hundred waitin outside the door You might also like Sweet little rock and roller Sweet little rock and roller Sweet little rock and roller Sweet little rock and roller Sweet little rock and rollerEmbed	4
Well it's Saturday night and I just got paid I'm a fool away my money, don't try to save My heart says, "Go go, have a time" Because Saturday night bar and I feel fine I'm gonna rock it up, I'll rip it up I'm gonna shake it up, I'm going to ball it up I'm gonna rock it, ball tonight I got a date and I won't be late Picking her up in my ' Cruise on down about the union hall John starts jumping, we'll have a ball Gonna rock it up, yes, I'm going to rip it up I'm gonna hake it up, I'm going to ball it up I'm gonna rock it and ball tonight Long about ten and I'm swinging high Me and my baby, rocking up in the sky Don't care if I spend my dollar Because tonight I'm gonna be one happy soul You might also like I'm gonna rock it up, I'll rip it up I'm gonna shake it up, I'm going to ball it up I'm gonna rock it, ball tonightEmbed	4
You came a long way from St. Louis You climbed the ladder of success I've seen the flashy foreign cars That were parked out in front of Your fancy address! You came a long way from St. Louis You broke a lot of hearts between I've met a gang of gloomy guys Who were doing all right Until you came on the scene! You blew in from the middle-west And certainly impressed The population here-abouts Well baby, I got news for you I'm from Missouri too So, naturally, I got my doubts! You got them dropping by the way-side A feeling I am not going to know You came a long way from St. Louis But baby, you still got a long way to go! You might also like My, how you come up! Hmmm, you really come on! Hey, I'll have your address! St. Louis woman You're a St. Louis doll! You left St. Louis far behind Keep this little thought in mind You still ... got a long way to go!Embed	4
Baby, here I stand before you with my heart in my hand I put it to read it, mama, hoping that you'll understand Well, baby, mama, please don't dog me 'round I would rather love you, baby, than anyone else I know in town Well this is my confession, mama, and I'm thrilled by all your charm It seems that I'm in Heaven, mama, when you hold me in your arms Well, baby, can I have you for myself? If I can't have you, baby, I don't want nobody else Oh, when my days are long and dreary and the sun refuse to shine I would never weep low and lonely if I knew that you were mine Well, baby, make everything alright And I have you, too, baby or will it be tomorrow night? Well, baby, don't you want a man like me? Well, baby, don't you want a man like me? You think only about the future, forget about your used-to-beYou might also likeEmbed	4
Hello, pretty baby How did your vacation go ? You know I long to be with you Because I really missed you so You must have many things to tell me But only one I yearn to know Shall we dance, pretty baby And does your love for me remain ? It's been a long hot summer With no one to entertain Ah, it's really boss to hold your hand, baby Dance and talk with you again Bye, bye for now But I shall call you on the phone I want to tell you how boss it was To have been your chaperone And if you choose me for your steady Darling, you'll never walk aloneYou might also likeEmbed	4
It wasn't me, baby; no, it wasn't me, baby It must have been some other body, uh uh, baby, it wasn't me Said he was cold, tired and hungry, came a-begging for bread The lady took him in and fed him breakfast in bed It wasn't me, boss; mmm-mmm, boss, it wasn't me It must have been some other body, uh uh, boss, it wasn't me You say you saw my car parked in the drive-in one night Came over to speak to me, I was out of sight It wasn't me, baby, mmm-mmm, baby, it wasn't me It must have been some other body, uh uh, baby, it wasn't me Yes, a shrewd young whipper snapper love to run and play But the draft board got him, they inducted him today It wasn't me, Sergeant; mmm, Sergeant, it wasn't me It must have been some other body, uh uh, Sarge, it wasn't me You might also like I met a German girl in England who was going to school in France Said we danced in Mississippi at a Alpha Kappa dance It wasn't me, Officer; no, Officer, it wasn't me It must have been some other body, uh uh, Officer, it wasn't me Wailing down the freeway, testing out the cruising power The state trooper trailing, clocked him ninety miles per hour It wasn't me, Sheriff; mmm-mmm, Sheriff, it wasn't me Ah! It must have been some other body, uh uh, Sheriff, it wasn't me Calling for brave young soldiers, needed on the front row Lieutenant said, "Which one of y'all volunteer to go?" It wasn't me, Captain; mmm-mmm, Captain, it wasn't me It must have been some other body, mmm-mmm, Captain, it wasn't meEmbed	4
Too late, too late to ask forgiveness Too late, too late to say goodbye She's gone, she's gone, she left this mornin' And this is how she said goodbye Upon my pillow was a letter She said, I still don't want to go But if you don't change your way of livin' May God have mercy on your soul You know I love you like no other But you have played around too long Goodbye, goodbye, I won't forget you But I will be a long time gone Too late, too late my heart keeps cryin' I should have known you'd go away Too late, I know my heart is dyin' It always seems to end this wayYou might also likeEmbed	4
Havana moon Havana moon Me all alone with jug of rum Me stand and wait for boat to come Is long the night, is quiet the dark The boat she late since twelve o'clock Me watch the tide easing in Is low the moon but high the wind Havana moon Havana moon Me all alone, me open the rum Is long the wait for boat to come American girl come back to me We'll sail away across the sea We'll dock in New York, the buildings high We find a home up in the sky Havana moon Havana moon You might also like Me still alone, me sip on the rum Me wonder when the boat she come To bring me love, oh sweet little thing She rock and roll, she dance and sing She hold me tight, she touch me lips Me eyes they close, me heart she flip Havana moon Havana moon But still alone me drinking the rum Begin to think the boat no come American girl she tell a lie She say, "Till then", she mean, "Goodbye" Havana moon Havana moon Me lay down alone, was good the rum Me fall asleep, the boat she come The girl she look till come the dawn She weep and cry and return for home The whistle blow, me open me eyes Was bright the sun, was blue the skies Me grab me shoes, me jump and run Me see the boat head for horizon Havana moon, is gone the rum The boat she sail, me love she gone Havana moon Havana moonEmbed	4
South of the border - down Mexico way That's where I fell in love, where the stars above - came out to play And now as I wander - my thoughts ever stray South of the border - down Mexico way She was a picture - in old Spanish lace Just for a tender while, I kissed a smile - upon her face 'Cause it was fiesta - and we were so gay South of the border - Mexico way Then she smiled as she whispered "manjanna" Never dreaming that we were parting Then I lied as a whispered "manjanna" 'Cause our tomorrow never came South of the border - I jumped back one day There in a veil of white, by the candle light - she knelt to pray The mission bells told me (ding-dong) - that I musn't stay South of the border - Mexico wayYou might also likeEmbed	4
In the wee hours of the morning After all have gone to bed Yes, I go all to myself Think of things that you have said Yeah, but I fall asleep, do you wonder If there is anything for me ahead I fell in love with you, baby Before I even held your hand And you were still in your teens Too young to understand But when you looked at me and smiled, darling That's when it all began You know I was just sitting here thinking About the things we used to do Ah, but you now belong to someone else And I'm still in love with you You know I wonder, I wonder Will I ever be back with youYou might also likeEmbed	4
When I was a little bitty boy My grandmother bought me a cute little toy A drum with jingles in between Said "Take care of your tambourine" Oh, my tambourine, my tambourine I do like to shake my tambourine My tambourine, my tambourine I keep on shaking my tambourine When I started Sunday School To learn to live by the Golden Rule I got happy and caused a scene Rose up and shook my tambourine Oh, my tambourine, my tambourine I do like to shake my tambourine My tambourine, my tambourine I keep on shaking my tambourine Once, I remember in grammar school I was talking to a girl in the vestibule She dug my music and my routine I showed her how to shake my tambourine You might also like Oh, my tambourine, my tambourine I love to shake my tambourine My tambourine, my tambourine I'ma keep on shaking my tambourine Soon as we finished junior high Had my tambourine standing by I took her graduation ring And linked it up with my tambourine Oh, my tambourine, my tambourine I keep on shaking my tambourine My tambourine, my tambourine I keep on shaking my tambourineEmbed	4
[Verse ] Arrested on charges of unemployment He was sittin' in the witness stand The judge's wife called up the district attorney She said "Free that brown-eyed man If you want your job you'd better free that brown eyed man" [Verse ] Flyin' across the desert in a TWA I saw a woman walkin' 'cross the sand She been walkin' miles en route to Bombay To meet a brown-eyed handsome man Her destination was a brown-eyed handsome man [Verse ] Way back in history, years In fact, ever since the world began There's been a whole lotta good women sheddin' tears Over a brown-eyed handsome man It's a lot of trouble with a brown-eyed handsome man [Guitar and Piano Solos] [Verse ] Beautiful daughter couldn't make up her mind Between a doctor and a lawyer man Her mother told her, "Darling, go out and find Yourself a brown-eyed handsome man Just like your daddy, he's a brown-eyed handsome man" You might also like[Verse ] Marlo Venus was a beautiful lass She had the world in the palm of her hand She lost both her arms in a wrestling match To meet a brown-eyed handsome man She fought and won herself a brown-eyed handsome man [Verse ] Two-three the count with nobody on He hit a high fly into the stand Roundin' third, he was headed for home It was a brown-eyed handsome man That won the game, it was a brown-eyed handsome manEmbed	4
Now if you want to hear some boogie like I'm going to play It's just an old piano and a knockout bass The drummer man's a cat they call Kicking McCoy I know you remember that rubber-legged boy Mama's cooking chicken fried and bacon grease Come on along boys, it's just down the road apiece Now there's a place you really get your kicks It's open every night from about twelve to six And if you want to get some boogie you can get your fill And shove and sting to you like an old steam drill Come on along you can lose your lead Down the road, down the road, down the road apiece Now there's a place you really get your kicks It's open every night from about twelve to six And if you want to get some boogie you can get your fill And shove and sting to you like an old steam drill Come on along you can lose your lead Down the road, down the road, down the road apieceYou might also likeEmbed	4
