text	label
I heard of a land on a far, the far away strand 'Tis a, the beautiful home of the soul It was built by Jesus, Jesus on high There, there we'd never, never will die 'Tis a land where we'll never grow, grow old We'll never, never grow old, never grow old Never, never, never, never, mm, never grow old I know there's a land, thеre's a land where wе'll never, oh, never grow old We ain't gon' grow old, we'll, we'll never, can I get you to help me say that? We'll never, never grow old, oh We'll never, good Lord, never grow old I know that there, I know that there is, there is a land where we'll never We can go there and we ain't gonna grow, ooh-hoo Never, never, never, never, never, oh, never Woo-hoo, yeah, yeah, ooh-oh-oh When you get through doin' down here there is a place He done laid out a land, oh, Lord Where we'll never, we'll never, never, we'll never, oh, grow old One of these old days, we're just gon' live on and on and on Somewhere where the wicked will cease from trouble And the needy will be enriched, I've heard about it There's a place where the saints will roam See mother and father, most of all, continue loving You might also likeI'm sure glad, so glad I got to, really got, hey My soul is, my soul, my soul is satisfied, yes it is, yes it is Yes it is, yes it is, yes it is, can I get y'all to help me sing? Religion Religion, woah, my soul, my soul is satisfied, yeah, yeah, yeah, yeah, yeah, yeah Yeah, we oughta sing that one more time, we oughta sing it one more time I'm so glad, I'm so glad, I'm so glad that I've got religion, woo-hoo-hoo, my soul My soul, my soul, my soul, my soul is satis— Satisfied, Lord, yeah, yeah, yeah, hey, hey, hey, hey Religion, religion, oh, religion, religion, woah, religion Goodnight, God bless and thank you, God be with you Let's hear it for 6Embed	0
Hey, I got a secret Sweetest daydream You and me I'm the land, you're the sea Rushing me and tenderly kissing me All along the shore Love forever more Just my daydream (daydream) Though it may seem (may seem) Vague and far away, I dream it every day It's just my day dream (daydream) Though it may seem (may seem) Too good to be true, that's 'cause it's all about you You're the night, and I'm on cloud number A private place we can find in our mind, hey, I can share with you I'm always there with you too Ooh, ooh, ooh Just my daydream, though it seem Vague and far away, I dream it every day Hee, just my daydream, though it may seem Too good to be true, that's 'cause it's all about you You might also like Crazy, crazy, crazy, that's what they call me Lately I'm beginning to feel they may be right 'Cause anyone who's sane would have to be crazy to lie around Daydreaming at night (daydreaming at night) Daydreaming at night (daydreaming at night) Daydreaming at night (daydreaming at night) Daydreaming at night You and me, I'm the land, you're the sea Rushing in tenderly kissing me All around the shore Love forevermore It's just my daydream (daydream) Though it may seem (may seem) Vague and far away, I dream it every day Just my daydream (daydream) Though it may seem (may seem) Too good to be true, that's 'cause it's all about you Ooh, crazy, crazy, crazy, that's what they call me Lately I'm beginning to think they may be right 'Cause anyone who's sane would have to be crazy to lie around Daydreaming at night (daydreaming at night) Daydreaming at night (daydreaming at night) Daydreaming at night (daydreaming at night) Daydreaming at night You and me, out of nowhere, suddenly (In the nightfall, in the night) And it's good, it's good, it's good, it's good It's good to know you're there Whatever's fair, sweet baby (in the nightfall, in the night) (In the night) Thank you for the love (Dream about you all the time) You set my way Yeah, yeah, yeah, yeah, yeah, yeah (In the nightfall ... in the night ... in the night) And I've got a secret (dream about you all the time) Sweetest daydream (in the nightfall) Said I've got a secret (in the night) Sweetest daydream, oh, yeah You and me, baby Out of nowhere, suddenly, oh Thank you for the love Mmm, mmm, yeah, yeah, yeah, yeah Shabba-dabba-dwee-da-dwee...Embed	0
Good evening, ladies and gentlemen May I say that it is a pleasure And, indeed, an honor to perform for you this evening I've chosen for my second selection A song that I feel is universal in the world It is understood on any continent, in any language And is as relevant today as it was the day it was written by John Newton Ah, ah-ah Amazing grace How, how sweet The, the sound That, that saved A, a wretch like, like me I, oh, I once Was, I was lost Ooh-ooh-ooh, but now I, I'm found Was, was blind But, but now I, I see Amazing grace, how sweet the sound That saved a wretch like me, oh, Lord I once was lost, but now I'm found Was blind, but now I see (I'm gonna ask thе ladies to join in) (Will you join in?) Amazing grace, how sweet the sound That savеd a wretch like me (Oh, Lord) I once was lost (I was lost), but now I'm found Was blind, but now You might also like He's amazing, He's amazing He's amazing, oh, yeah He's amazing (He's amazing) Oh-oh, yes, He is He's amazing (Oh, yeah) He's amazing now, ah-ah-ah Ooh, I see I see (See), oh yeahEmbed	0
I hate to say, I told you so Though you deserve it, because you know You left me crying, for someone new But all the heartache, came back to you Now you’re begging me to take you back I told you so, I told you so When you were king and riding high You thought your new love would never die While you were laughing, I cried alone You wouldn't even, throw me a bone Now you’re begging me to take you back I told you so, I told you so The things you sew, I know you should have reap I told you so, I told you so You outta learn to look before you leap I told you so, I told you so You can’t win when you’re a jumping jack I told you so, I told you so I hate to say, I told you so But listen closely, I'll say it slow When you were leaving, I told you then You needn't ever, come back again So let me tell you with a last goodbye I told you so, I told you so So let me, let me, tell you with a last goodbye I told you so, I told you soYou might also likeEmbed	0
If you should loo-oo-se me Oh, yeah, you'll lose a good thing If you should loo-oo-se me Oh, yeah, you'll lose a good thing You know I love you Do anything for you Just don't mistreat me An I'll be good to you Because if you should loo-oo-se me Oh, yeah, you'll lose a good thing I'm giving you one more chance For you to do right If you'll only straighten up We'll have a good life Because if you should loo-oo-se me Oh, yeah, you'll lose a good thing You might also like This is my last time Not asking any more If you don't do right I'm going to march out of that door And if you don't be-lee-eeve me Just try it, daddy An you'll lose a good thing Just try it, daddy An you'll lose a good thing Just try it, daddy An you'll lose a good thingEmbed	0
Sure you haven't got the wrong number? You sure it's me you want to talk to tonight? Everyone in town's got your number Everybody's got you pegged right Is that why you got in touch with me? I guess you must be running out of fools When you went and left me there crying Your goodbye was even colder than ice It didn't bother you I was crying And now you want to break my heart twice Is that why you got in touch with me? I guess you must be running out of fools Guess you got back (Guess you got) To my name (To my name) In your little black book Well, listen Tell you what (Tell you what) I bet you forgot (You forgot) How I even look You might also like So go ahead with all your sweet talking Go ahead for all the good it can do Have yourself a dime's worth of talking And then I'm going to hang right up on you 'Cause this time, you're not, you're not getting through to me I guess you must be running out of fools Even fools like me Even fools like me I said you're running out of fools Even old fools like meEmbed	0
I am everyday people, yeah yeah Yo Gang, let’s kick the ballistics Let’s party big time, oh Get up everybody, oh whoo yeah Sometimes I'm right, I can be wrong My own beliefs are in my song A thinker, a banker, a drummer and then Makes no difference what group I'm in I am everyday people, yeah yeah There is a blue one (uh-huh) that don’t accept the green one (what you say) Cracking on the fat one (uh-huh), like I’m about to be a skinny one (oh) Different strokes for different folks, and so on and so Scooby dooby doo-yaa-doo-yaa-doo Oh sha sha - we got to live together I am no better and neither are you We’re basically the same whatever we do First you love me and then you hate me, you think you know me and then You can't figure out if You might also like I am everyday people, yeah yeah There is a cone head (uh-huh) that don't accept the dome head (what you say) Sisters and brothers (uh-huh) let's be cool with each other (oh) Different strokes for different folks, and so on and so on Etcetera, etcetera Oh sha sha - we got to live together, yeah This track is killing me Lord have mercy Go go, go queen of soul Go go, go queen of soul Go go, go queen of soul Go go, go queen of soul There is a yellow one (yellow one) That ain't into the red one (red one) We don't about the black one (black one) Ha, What about white one y'all? (white one) Different lengths don’t come with no dress And so on and so on Scooby dooby doo-bee-doo-yaa-doo I am everyday people, yeah yeah I am everyday people, yeah yeah Want to take you higher Higher, Higher I am everyday people, yeah yeah I am everyday people, yeah yeahEmbed	0
In the land of my dreams You're sweeter than ever before In the land of my dreams You love me so much more I am over here so I'll stay, you'll never stay If they could only be real (if they could only be real) Instead of just in my head In the land of this wonderful dream (wonderful dream) I imagine you all so close Telling all of the girls who love you to You love me the most (love me the most) And when you walk by, I start to laugh of dream and glow 'Cause when I wanna be with you I close my eyes and all way I go, go, go (the way I go) In the land of my dreams Where it's give and take Give your love to me (give your love to me) But some should get out our way Give your, give your love to me (give your love to me) But some should get out our way Give your love to me (give your love to me) But some should get out our wayYou might also likeEmbed	0
One more time you hurt me You thought you you had your victory One more reason for you to worry 'Cause you got the best of me You should never count your chickens Before you eggs get hatched I believe it, mm, to my soul You finally met your match Tell me now When this battle is over Who will wear the crown When this battle is over Who will wear the crown Who it will be Who it will be Will it be you Will it be me Tell me now: who will wear the crown, yeah, yeah Ever time i kiss ya I feel I get the upper hand I want you, ooo, to surrender And tell me ya going be my man A slip of the lip has been known to sink a ship And i believe I believe I believe to my soul I finally got a winner's slip You might also like When this battle is over Who will wear the crown When this battle is over Who will wear the crown Who it will be Who it will be Will it be you Will it be me Yeah, tell me now: who will wear the crown When this battle is over? Who be wearing this crown When this battle is over? Oh, when it's over, children When this battle is over Yeah, when it's overEmbed	0
I heard those rumors You'll soon be gone They say there's no use In holdin' on But I love you so I would die if I let you go Say it's not true, no, no, no, no That I'm losing you (I'm losing you, I'm losing you) They say you cheated They tell me you lied My love don't change The way I feel inside And if it's so, then don't tell me 'Cause I don't wanna know Say it's not true, no, no, no, no That I'm losing you (I'm losing you, I'm losing you) You might also like If I lost you What would I do? After all, all we've been through Come on, come on Maybe she's only Passion thing Well, if she is you go on and have yourself a fling 'Cause when you're through I'll be here Waiting, waiting just for you, ooh Say it's not true, no, no, no, no That I'm losing you, youEmbed	0
Darling you send me Darling you send me Darling you send me Honest you do Honest you do Honest you do Woah-Oh-Oh You thrill me, darling you thrill me Baby you, you thrill me Honest you do Honest you do Honest you do At first I thought it was infatuation But it lasted so long, so long Now I find myself wanting I want you to marry me, please take me home Yeah, yeah, yeah, yeah, yeah, yeah You, you send me Darling you send me Darling you, send me Honest you do Honest you know ya did Ya know, ya did Ya know ya, do know (you-ooh-hoo send me) You got everything it takes to wed me (you-ooh-hoo send me) And when you do the things you do you know that send me (do-ooh-hoo send me) Honestly, you send me You send me, baby, you send me You move me (do) You groove me (do) Whoooo, you send me Ah yes, ah yes, ah yes, thank you to send me Guess I'm a, a sinner Make me a longer I, I, I, I, I, I, I just can't stand any it Thrill me, kill me Oooh, send me, send me baby Pretty baby, oooh yeahYou might also likeEmbed	0
Pretender Ooh, pretender I wake myself up every time I daydream of love for you and me 'Cause I'm just fooling myself I should remember You're just a pretender of love (Nothing but a pretender) Can't love no one (Pretending to be in love) Ooh, pretender (No one but a pretender) Can't love no one (Pretends to be in love) You can't trust the imagination It never tells you who's for real You don't give love You're just a lender I should remember That you're just a pretender You might also like (Nothing but a pretender) Can't love no one (Pretending to be in love) Oh but I wanted (To be your) I wanted to be (To be your lover) To be what you wanted Everything you could need Oh yeah (Every) You were everything (I could dream of) I ever could dream of But I really (Should be your) Really should be (Should be your lover) Keeping your, feeling your, having your love Oh, pretender (Pretender) Pretender, give me your love Oh, ooh, yeah Pretender, why can't you be for real? Ah baby Pretender, why won't you believe in what you feel? Well, I thought you were mine, baby, all the time And I know that you dig what I'm sayin' It's a player's dream just to have a fool But sweet baby, I ain't playin' It's funky nothin's, baby (Nothing but a pretender) Can't love no one (Pretending to be in love) Ooh, pretender (No one but a pretender) Can't love no one (Pretends to in love) Oh, pretender (Nothing but a pretender) Can't love no one (Pretending to be in love) Ooh, pretender (No one but a pretender) Pretender (Pretends to in love) Oh, pretender (Nothing but a pretender) Can't love no one (Pretending to be in love) Ooh, pretender (No one but a pretender) Can't love no one (Pretends to be in love)Embed	0
I'm only one step ahead of heartbreak One step ahead of misery One step is all I'd have to take backwards To be the same old fool for you I used to be I'm only one step ahead of your arms One kiss away from your sweet lips I know I can't afford to stop for one moment 'Cause I'm just out of reach of your fingertips Your warm breath on my shoulder Keeps reminding me That it's too soon to forget you It's too late to be free, can't you see? I'm only one step ahead of your love I try and yet I can't take two Seems like I'll have to take that one step backwards 'Cause one step ahead is a step too far away from you 'Cause one step ahead is a step too far away from you Just one step ahead is a step too far away from youYou might also likeEmbed	0
Now, listen here, girls I’m going to tell you what I want right now I want a rough lover I want a man I want a rough, tough lover And I’ll find him if I can He’s got to bite nails Fight bears And if I get sassy Be a man who dares To shut me up and kiss me so I know he cares I want a man Don’t want a mean daddy I want a boss I want a mean, sweet daddy Who the devil wouldn't cross He’s got to spit fire Chew iron Get mad and start roaring like a mountain lion Then whisper that he loves me so I know he’s mine I want a man You might also like I’m looking for a guy who’s brave and strong But weak for me I’m looking for a guy who’ll ride around But never, never set me free I want a rough lover I want a man I want a rough, tough lover With a sentimental plan So he can kiss nice Hug tight He’s got to be sweet and gentle Day and night But mean enough to make me wanna to treat him right I want a man, oh yeah I’m looking for a guy who’s brave and strong But weak for me I’m looking for a guy who’ll ride around But never, never set me free I want a rough lover I want a man I want a rough, tough lover With a sentimental plan So he can kiss nice Hug tight He’s got to be sweet and gentle Day and night But mean enough to make me wanna to treat him right I want a man I want a man I don’t want no cream puff, baby I don’t want no butterfly I want a man Oh, yes, I do Oh, yes, I doEmbed	0
I think that's what sets it up One, two, three One, two, three, four Though you don't call me anymore I sit and wait in vain I guess I'll rap on your door On your window pane I wanna tell you, baby Changes I've been going through Missing you, listen, you 'Til you come back to me, that's what I'm gonna do Why did you have to decide you had to set me free? I'm gonna swallow my pride I'm gonna beg you to please, baby, please see me Gonna walk by myself to prove that my love is true All for you 'Til you come back to me, that's what I'm gonna do You might also like Living for you, my dear Is like living in a world of fear Hear my plea, I've got to make you see That our love is dying Although your phone, you ignore Somehow I must, somеhow I must explain I'm gonna rap on your door Tap on your window pane Gonna camp by your steps 'til I gеt through to you I've got to change your view 'Til you come back to me, that's what I'm gonna do 'Til you come back to me, that's what I'm gonna do 'Til you come back to me, that's what I'm gonna do I'm gonna rap on your door Tap on your window pane, open up, baby Window pane, open up, baby Tap on your door, tap on your window pane Window pane Let's make a track nowEmbed	0
When I go for a walk I meet old friends we knew We sit around and talk (Yes, we sit and talk) Oh, then they ask about you (Then they ask about you) What's the good if I say That you and I are through I simply tell them you're okay (Tell them you're okay) Oh, when, when they ask about you (When they ask about you) They wonder where we've been And why we fail to call (And you don't ever call) And I take it on the chin Until the teardrops fall (When the teardops fall) They, they, they don't mean to be smart Mmm, but if they, if they only knew That they're stepping on my heart (Stepping on my heart) When they ask, when they ask about you (When they ask about you) You might also like They're stepping and walking on my heart Oh, when they ask, when they ask about you, yeah yeah yeah (When they ask about you)Embed	0
Ooh, ooh ah; ooh, ooh ah Ooh, ooh ah; ooh, ooh ah Come with me to the disco Ow Hey, I've seen everybody showing time, ooh yeah And I've been over here, y'all, and moving around, uh-huh Well, I'm tired of looking at everybody's show I think it's time that I get out on the floor 'Cause tonight (Tonight) Tonight, oh, tonight (Tonight) Tonight (Oh wow) I'm gonna be the only star tonight at the disco, ooh yeah I'm gonna be the only star tonight at the disco, ooh yeah Come with me to the disco Make way for the lady 'cause here I come, ooh yeah Me and my partner gonna do it up right tonight, and then somе I got me a dress with the fringеs by heart And let me give you tips, we dance hard You might also like 'Cause tonight (Tonight) Tonight, oh oh, tonight (Tonight) Tonight, yeah I'm gonna be the only star tonight at the disco, ooh yeah I'm gonna be the only star tonight at the disco, ooh yeah Ah ha, ah ah ha, ha (Shake it up) Ooh hoo, ooh hoo hoo, hoo (Shake it down) Ah ha, ah ah ha, ha (Start the show) Ooh hoo, ooh hoo hoo, hoo (Spinning round and round) Hey y'all, it's getting late and it's time to go home, yes it is But you'll remember this night long after you're gone, yes you will Remember the cheers, remember the fun When you were boogiein' down with your only one 'Cause tonight (Tonight) Tonight, yeah, tonight (Tonight) I said tonight (Ooh wow) I'm gonna be the only star tonight at the disco, ooh yeah I'm gonna be the only star tonight at the disco, ooh yeah I'm gonna be the only star tonight at the disco, yes I will, ooh I'm gonna be the only star tonight at the disco, yes I will, ooh We're disco queens, we're disco queens You know what that means, we're disco queens We're disco queens, we're really out of sight We're disco queens, the only stars tonight We're disco queens, universal machine We get down with the rock and you've got to see as freak We're disco queens, ¿que pasa? ¿eh, que pasa? Se habla español, sí, sí, hermano, eh, hermano Uno, dos, tres, cuatro, libres locos, here we go La disco queen, sophisticated magnifique We get down with the rock and you've got to see as freak I'm gonna boogie down, boogie down Gonna have fun good morning run I'm gonna shake it up, I'm gonna shake it down Ooh yeah, ooh yeah, ooh yeah, all around Doo-doo-doo, ha, doo-doo-doo, ha ha Doo-doo-doo, doo, doo-doo-doo-doo-doo-doo-doo I'm gonna be the only star tonight at the discoEmbed	0
I gave my heart and soul to you, boy Didn't I do it, baby? Didn't I do it, baby? I gave you the love that you never ever knew, boy Didn't I do that, baby? Didn't I do that, baby? I've cried so many times and that's no lie (I've cried so many times and that's no lie) It seems to make you laugh each time I cry (It seems to make you laugh each time I cry) Baby, can you dig it? Didn't I blow your mind this time, didn't I? (Yes you did, yes you did, yes you did) And tell me, didn't I blow your mind this time, didn't I? (Yes you did, yes you did, yes you did) I thought that love of yours was true, boy Didn't I think that, baby? You know that I thought that, baby But this time I am really leavin' you, boy Don't you know that, baby? I know you know that, baby You might also like Ten times or more, I've walked out that door (Ten times or more, you walked out the door, yes you did) But just be sure you get it straight this time, baby, there won't be no more Baby, can you dig it? And didn't I blow your mind this time, didn't I? (Yes you did, yes you did, yes you did) Oh, oh, didn't I blow your mind this time, didn't I? (Yes you did, yes you did, yes you did) (Didn't I do it to you?) Didn't I do it? (Didn't I do it to you?) Didn't I do it? (Didn't I put it on you?) Didn't I do it? Didn't I do it? (Didn't I do it to you?) Didn't I do it? (Didn't I do it to you?) Hey, didn't I do it? (Didn't I put it on you?) Didn't I, didn't I? Oh, how many times did I walk out that door? (Ten times or more, you walked out the door, yes you did) (But just be sure you get it straight this time, baby, there won't be no more) Baby, can you dig it? Baby, can you dig it? Didn't I blow your mind this time, baby, didn't I? (Yes you did, yes you did, yes you did) Oh, didn't I blow your mind this time, didn't I? (Yes you did, yes you did, yes you did) Now, didn't I blow your mind this time, didn't I? Blow your mind this time, didn't I? (Oh yeah) Blow your mind this time, didn't I? Blow your mind this time, didn't I?Embed	0
Baby we've got to have us a little talk Gonna have to pack up my things I'm gonna walk You say a dollar goes from hand to hand But before I see you go from woman to woman I'd rather drink Muddy water Sleep out in a hollow log Yes, I would I love you baby but you just won’t be fair I don’t believe you know how to be on the square Now go on and have your fun and if you must But before I have another man that I cannot trust I'd rather drink Muddy water Sleep out in a hollow log Yes, I would You promised me you were gonna live by the golden rule I work all day and walk just like a fool For you my kisses are sweet as they can be But before I see you make a stone fool out of me You might also like I'd rather drink muddy water Yes I'd rather drink muddy water I'd rather drink muddy water Oh, yes I would I’d rather drink muddy water Yeah, yeah, yeah, yeah, yes I would Show me the way, way, way, way, way down To that place I can find that muddy water I'll go ahead and turn it on up I say I'd rather drink muddy water I'd rather drink muddy, muddy, muddy water Sleep out in a hollow logEmbed	0
People say I'm the life of the party Because I tell a joke or two Well, although I may be laughing loud and hearty Deep inside I'm blue So take a good look at my face You'll see that my smile seems out of place And if you look closer, it's easy to trace The tracks of my tears I need you, need you Since you left If you see me with someone else Acting like I'm having big fun Well, although he may look fine He's not a really man You're the only one So take a good look at my face You'll see that my smile seems out of place And if you look closer, it's easy to trace The tracks of my tears You might also like I'm masquerading My hope is fading Since you put me down My smile is my make-up I wear since my break up with you Baby, take just a, one good look at my face And see that my smile seems out of place And if you look closer, it's so easy to trace The tracks of my tears Oh baby, take just one look at my face You'll see that my smile is out of place And if you look closer, it's easy to trace The tracks of those tears Oh oh oh oh, oh oh oh One look at my face You'll see that my smile seems out of place And if you look closer...Embed	0
