text	label
My Papa was a hobo when they delivered me We didn't have a doctor 'cause he couldn't pay the fee But when the going got too bad to ease his misery Papa played the dobro this a-way and he'd go When company would come around, he kept the dobro hid He knew he couldn't play the way the other players did Why the guitar's resonator was a gallon-bucket lid But Papa played the dobro this way and he'd go Well now that Papa's gone away, it's hanging by the flue The top of it's rusted and the strings are rusty too It won't ever sound the way that it did when it was new When Papa played the dobro this a-way and he'd goYou might also likeEmbed	6
It rained all the way to Cincinnati With our mattress on top of the car Us kids were eatin' crackers and baloney And papa kept on driving, never stopped once at a bar Then mama started talking about Jesus And how our life could be from now on While papa bought a used tire in Columbus Mama rocked the baby 'til all her tears were gone She said, 'Your papa is a good man and don't you kids forget it The whiskey's tryin' to ruin him, but I know the Lord won't let it' Then we sang Amazing Grace and Bringing In The Sheaves Rock of ages, rock of ages cleft for me I remember when papa finally gave up drinking I think mama was the only one on earth that really thought he could I remember all the times we'd packed everything we owned Into some old car and started out for some new town And through it all mama's faith was the one thing That was strong enough to finally do some good She said, 'Your papa is a good man, and don't you kids forget it The whiskey's tryin' to ruin him, but I know the Lord won't let it' Then we sang Amazing Grace and Bringing In The Sheaves Rock of ages, rock of ages cleft for meYou might also likeEmbed	6
I keep a close watch on this heart of mine I keep my eyes wide open all the time I keep the ends out for the tie that binds Because you're mine, I walk the line I find it very, very easy to be true I find myself alone when each day's through Yes, I'll admit that I'm a fool for you Because you're mine, I walk the line As sure as night is dark and day is light I keep you on my mind both day and night And happiness I've known proves that it's right Because you're mine, I walk the line You've got a way to keep me on your side You give me cause for love that I can't hide For you, I know I'd even try to turn the tide Because you're mine, I walk the line I keep a close watch on this heart of mine I keep my eyes wide open all the time I keep the ends out for the tie that binds Because you're mine, I walk the lineYou might also likeEmbed	6
Happy to be with you happy to be with you Happy to be with you bound to follow you Somewhere someone above sents you to me for me to love Hearts can tremble and shake hearts can shutter and break I give more than I take cause I'm happy to be with you Happy to be with you happy to be with you Good times outweigh the bad count the good ones we've had We have our ups and downs but the good times come around Nickels and pennies are few don't have a fortune for you Love you yes I do and I'm happy to be with you Happy to be with you happy to be with youYou might also likeEmbed	6
Delia, oh, Delia Delia all my life If I hadn'ta shot poor Delia I'da had her for my wife Delia's gone, one more round, Delia's gone First time I shot her Shot her in the side Hard to watch her suffer But with the second shot, she died Delia's gone, one more round, Delia's gone Well, the guilty get a sentence But I ain't gonna tell you mine 'Cause I got a brother in Memphis Doin' life or ninety-nine Delia's gone, one more round, Delia's gone But jailer, oh, jailer Jailer, I can't sleep 'Cause all around my bedside I hear the patter of Delia's feet Delia's gone, one more round, Delia's gone Now you give me my hammer I'll drag the ball and chain And every rock I bust I seem to ring out Delia's name Delia's gone, one more round, Delia's gone Delia's gone, one more round, Delia's gone You might also likeOh, Delia Delia's gone like a July snow Delia's goneEmbed	6
There's an engine at the station and the whistle calls my name It's calling, calling, calling, come and get aboard the train My baby's gone and I'm alone to live in misery I'm going to call and make a reservation for me Going to ride a blue train, going to ride a blue train Going to ride a blue train, going to ride a blue train I'm going to climb aboard and ride until I learn to smile I'll be knocking out the blues while I'm knocking out the miles With my guitar, beat and rhythm, to the click-clack of the wheels I'm going to sing the blues because that's the way that I feel Conductor, go and tell the man to shovel on the coal It doesn't seem half as bad as long as I can roll Give me another ticket and I'll stay and ride with you There's nothing left to live for in this world, we're rolling through You might also likeEmbed	6
Ira Hayes Ira Hayes Call him drunken Ira Hayes He won't answer anymore Not the whiskey drinking Indian Nor the Marine that went to war Gather round me people there's a story I would tell About a brave young Indian you should remember well From the land of the Pima Indian A proud and noble band Who farmed the Phoenix valley in Arizona land Down the ditches for a thousand years The water grew Ira's peoples' crops Until the white man stole the water rights And the sparkling water stopped Now Ira's folks were hungry And their land grew crops of weeds When war came, Ira volunteered And forgot the white man's greed Call him drunken Ira Hayes He won't answer anymore Not the whiskey drinking Indian Nor the Marine that went to war You might also like There they battled up Iwo Jima's hill Two hundred and fifty men But only twenty-seven lived to walk back down again And when the fight was over And when Old Glory raised Among the men who held it high Was the Indian, Ira Hayes Call him drunken Ira Hayes He won't answer anymore Not the whiskey drinking Indian Nor the Marine that went to war Ira Hayes returned a hero Celebrated through the land He was wined and speeched and honored Everybody shook his hand But he was just a Pima Indian No water, no home, no chance At home nobody cared what Ira'd done And when did the Indians dance? Call him drunken Ira Hayes He won't answer anymore Not the whiskey drinking Indian Nor the Marine that went to war Then Ira started drinking hard Jail was often his home They'd let him raise the flag and lower it Like you'd throw a dog a bone! He died drunk early one morning Alone in the land he fought to save Two inches of water in a lonely ditch Was a grave for Ira Hayes Call him drunken Ira Hayes He won't answer anymore Not the whiskey drinking Indian Nor the Marine that went to war Yeah, call him drunken Ira Hayes But his land is just as dry And his ghost is lying thirsty In the ditch where Ira diedEmbed	6
When I was a little bitty baby, my mama would rock me in my cradle In them old cotton fields back home When I was a little bitty baby, my mama would rock me in my cradle In them old cotton fields back home Now when them cotton bolls get rotten, you can't pick very much cotton In them old cotton fields back home It was down in Louisiana, just about a mile from Texarkana In them old cotton fields back home (In them old cotton fields back home) When I was a little bitty baby, my mama would rock me in my cradle In them old cotton fields back home When I was a little bitty baby, my mama would rock me in my cradle In them old cotton fields back home Now when them cotton bolls get rotten, you can't pick very much cotton In them old cotton fields back home It was down in Louisiana, just about a mile from Texarkana In them old cotton fields back home (In them old cotton fields back home) When I was a little bitty baby, my mama would rock me in my cradle In them old cotton fields back home When I was a little bitty baby, my mama would rock me in my cradle In them old cotton fields back home Now when them cotton bolls get rotten, you can't pick very much cotton In them old cotton fields back home It was down in Louisiana, just about a mile from Texarkana In them old cotton fields back home (In them old cotton fields back home) You might also likeIn them old cotton fields back home (In them old cotton fields back home) In them old cotton fields back home (In them old cotton fields back home)Embed	6
On your knees you are taller than trees You can look over heartaches and pain When my faith is gone to my knees I will go, growing stronger and taller than trees One night it was a long time ago now I knelt at my mother's knee And she said, "Son lift up your eyes to Him in the skies And you'll grow like the mighty oaks But you son, created in the image of God Can become taller even taller than the tallest of trees" And this was the answer I felt as down at her knees I knelt "On your knees you're taller than trees You can look over all your heartaches And son you can look over all of your pains" When my faith is gone to my knees I will go, growing stronger and taller than treesYou might also likeEmbed	6
If you going to be king of the hill You can't make it at the cotton mill If you going to be king of the hill You can't make it at the cotton mill Get put on at the Harlan mine Be the last one out at quitting time You already working when the whistle blew Never complain about a job to do When they say who can, you say I will If you ever going to be king of the hill You need a good woman to share your bed To keep you loved and to keep you fed To help you to face another day To get you up and on your way Where the golden rule don't rule out true You do to them before they do to you Watch out for yourself or nobody will If you ever going to be king of the hill You might also like Saturday night you go to Harlan town You shoot some pool and you fool around You watch the girls and you drink bootleg Get starved to death before you beg You trust in luck till your luck is gone Then jump right in and you hang right on There may be times you would have to kill If you ever going to be king of the hill When the last of the coals out of every vein Had long been gone on the northbound train Walk up to the top and if you're standing still You can call yourself king of the hill But if you fall like a lot have done By accident or knife or gun When they lay you high on the mountain still You can call yourself king of the hill Embed	6
I found him by the railroad track this morning I could see that he was nearly dead I knelt down beside him and I listened Just to hear the words the dying fellow said He said, "They let me out of prison out in Frisco For ten long years I paid for what I done I was trying to get back to Louisiana To see my Rose and get to know my son" "Give my love to Rose please, won't you, mister? Take her all my money, tell her, "Buy some pretty clothes" Tell my boy that daddy's so proud of him And don't forget to give my love to Rose" "Won't you tell them I said thanks for waiting for me Tell my boy to help his mom at home Tell my Rose to try to find another 'Cause it ain't right that she should live alone Mister, here's the bag with all my money It won't last them long the way it goes God bless you for finding me this morning Now, don't forget to give my love to Rose" You might also like "Give my love to Rose please, won't you, mister? Take her all my money, tell her, "Buy some pretty clothes" Tell my boy that daddy's so proud of him And don't forget to give my love to Rose"Embed	6
You think you know the smile on her lips The thrill at the touch of her fingertips But I forgot more than you'll ever know about her You think you'll find a heaven of bliss In each caress and each tender kiss But I forgot more than you'll ever know about her You stole her love from me one day You didn't care how you've hurt me But you can never steal away Memories of what used to be You think she's yours to have and to hold But someday you'll learn when her love grows cold That I forgot more than you'll ever know about her You stole her love from me You didn't care how you hurt me But you can never steal away Memories of what used to be You think she's yours to have and to hold But someday you'll learn when her love grows cold That I forgot more than you'll ever know about herYou might also likeEmbed	6
Now we are in the city of Bethlehem At the door of the Church of the Nativity where Christ was born The gate has been walled up then enters into the church because of the horsemen That used to come attack the place and sack the church It's been walled up to where there's just a very narrow opening of about Three and a half feet where you enter into the Church of Nativity So now we enter into the place where Christ was born This is the place where Christ was born to the world over it's a mighty big place Actually physically it's a small cave underneath the Church of the Nativity Many other people are here today to see this place Before me is the actual spot where Christ was born undisputed to the ages This place was found and confirmed that it was the place of the Nativity By St Helene mother of Constantine the Emperor of Rome In the third and the fourth century Just a few feet away from this place where Christ was born Where there is a Star of Bethlehem in the manger Where he was taken wrapped in swaddling clothes Meaning loose-fitting clothes laid in the manger Where he was come and visited at this very spot by the three Wisemen from the east One of the holiest of holy places In the Christian tradition the Holy Family retreated here During the massacre of the holy innocence ordered by King Herod And just as we left the Church of the Nativity a few minutes ago We saw another cave where so many of the children That King Herod had killed under two years old were buriedYou might also likeEmbed	6
Today I passed you on the street and my heart fell at your feet I can't help it if I'm still in love with you Somebody else stood by your side and he looked so satisfied I can't help it if I'm still in love with you A picture from the past came slowly stealing As I brushed your arm and walked so close to you Then suddenly, I got that old time feeling I can't help it if I'm still in love with you It's hard to know, another's lips will kiss you And hold you just the way I used to do Oh, Heaven only knows how much I miss you I can't help it if I'm still in love with youYou might also likeEmbed	6
Way down the mountain I chased a moonbeam On the beach I built sand castles too My moonbeams faded my castles tumbled All of this was meaningless cause happiness is you No more chasing moonbeams or catching falling stars I know now my pot of gold is anywhere you are My heart won't miss you my heart goes with you Loneliness is emptiness but happiness is you I tried to doubt you and live without you Tried to deny but I love you like a do But I realize now and I'll admit it You'll always be a part of me because happiness is you You might also likeEmbed	6
[Verse] I dreamed I walked in a field of flowers Oh, what a dream The houses all were silver towers Oh, what a dream Beside the road an angel sat I said hello and tipped my hat And stopped when I saw her smile And set me down a while I set me down a while You dreamer you I tried the angel for a kiss Oh, what a dream But she turned away and my lips missed Oh, what a dream She said, "Sir, I'll have you know I met you just a while ago You're welcome for to sit But calm yourself a bit, sir Calm yourself a bit You dreamer you I fell in love like one, two, three Oh, what a dream I asked the angel to marry me Oh, what a dream She said, "Sir, I can't marry you But I'm a dream that can come true There are dreams of much my worth That live upon the earth, sir Live upon the earth You dreamer you" Then I awoke and found my love Oh, what a dream As heavenly as the one above Oh, what a dream We'll marry in a sea of flowers Home will be a silver tower You might also like[Outro] There'll be heaven in my life With an angel for a wife[x] You dreamer you[x]Embed	6
Bring a drink of water, Leroy Bring a drink of water (no) If I could get to the mercy man He'd give me some I know I got a gal in Vicksburg Bertha is her name Wish I was tied to Bertha Instead of this ball and chain I'm going to Memphis That's right Lord, yeah A dude took all my money Wouldn't let me see the cards I owe the boss about a hundred years For sleeping in his backyard I'm going to Memphis (yeah Memphis) Yeah I'm going to Memphis Like a bitter weed, I'm a bad seed But when that levee's through and I am too Let the honky-tonk roll on Come morning I'll be gone You might also like I'm going to Memphis Yeah Memphis I never been to Chicago But it must be a mighty fine place (that's right) I couldn't get past Tennessee With Mississippi all over my face I'm going to Memphis (That's right Lord, Memphis) Well, the freezing ground at night Is my own folding bed Poke salad is my bread and meat And it will be till I'm dead Well, I brought me a little water In a Mr. Prince Albert can But the boss man caught me drinking it And I believe he broke my hand They all call me crazy for sassing Mr. Scott My brother was killed for a deed I did But I this remember what, yeah Well another boy is down The shovel burned him out Let me stand on his body To see what the shoutin's about I'm going to Memphis (yeah Memphis) Yeah I'm going to Memphis Like a bitter weed, I'm a bad seed But when that levee's through and I am too Let the honky-tonk roll on Come morning I'll be gone I'm going to Memphis Yeah Memphis (Yes Lord, Memphis-bound)Embed	6
There's a boy across the street lately he's looked very neat Seems he's always on the run down the street to (Seems he's always on the run down the street to ) Saturday he mows the lawn it's about a crack of dawn Nine o'clock the work's all done down the street to (Nine o'clock the work's all done down the street to ) When it's back to school this fall winter's chill may end it all But for now there's lots of fun with the girl at (But for now there's lots of fun with the girl at ) Maybe they will never wed sure they may break up instead But for now she is the one the girl who lives at (But for now she is the one the girl who lives at ) The boy who lives across the street has a reason to be neat He's in love and on the run with the girl at (He's in love and on the run with the girl at ) Don't you tell them to beware of a summer love affair You know she is only one the girl that live at (You know she is only one the girl that live at )You might also likeEmbed	6
I was riding Number Heading south from Caroline I heard that lonesome whistle blow I got in trouble, had to roam I left my gal and left my home I heard that lonesome whistle blow Just a kid, acting smart I went and broke my darling's heart I guess I was too young to know They took me off the Georgia Main Locked me to a ball and chain I heard that lonesome whistle blow All alone I bear the shame I'm a number, not a name I heard that lonesome whistle blow All I do is sit and cry When that evening train goes by I heard that lonesome whistle blow I'll be locked here in this cell 'TIl my body's just a shell And my hair turns whiter than snow I'll never see that gal of mine I'm in Georgia doing time I heard that lonesome whistle blowYou might also likeEmbed	6
[Verse] To love you so and still not have you will destroy me in time So I'm going away where nobody knows me and get you off of my mind I've packed my things a dozen times but unpack is all I do Yes I'm still in town still around and still in love with you [Chorus][x] I made it to the edge of town and turned around I made it to the bridge downtown by my nerve let me down I tried to go but how can I leave when all roads lead to you Yes I'm still in town still around and still in love with youYou might also likeEmbed	6
I do my best to hide this lowdown feeling I try to make believe there's nothing wrong But they're always asking me about you, darling And it hurts me so to tell 'em that you're gone If they ask me, I guess, I'd be denying That I've been unhappy all alone But if they heard my heart, they'd hear it crying "Where's my darling, when's she coming home?" I ask myself a million times what's right for me to do To try to lose my blues alone or hang around for you Well, I make it pretty good until that moon comes shining through And then I get so doggone lonesome Time stands still when you're a-waiting Sometimes I think my heart is stopping too One lonely hour seems forever Sixty minutes more to wait for you But I guess I'll keep waiting 'til you're with me 'Cause I believe that loving you is right But I don't care if the sun don't rise tomorrow If I can't have you with me tonight You might also like Well, I know I'll keep on loving you cause true love can't be killed I ought to get you off of my mind, but I guess I never will I could have a dozen others, but I know I'd love you still 'Сause I get so doggone lonesomeEmbed	6
[Verse ] It's not that I don't love you anymore It's not that I don't want to It's just that there's a line I have to darw You've gotta cross it, don't you It would take so little You know I long to stay [Chorus] Not until the wind changes Not until my heart erases Ever single memory of you [Verse ] It's not that you can't hurt me anymore It's not that you don't want to It's just that there's a door I have to close You've got to lock it, dont you There is darkness in our lives We can't see the light [Chorus] [Verse ] I don't want to lose what we never had I don't want the dream of living in the past If you've got to leave I don't want to know I never saw you coming I don't want to watch you go You might also like[Chorus] Not until the wind changes Not until my heart erases Ever single memory of you Might as we be history Every single memory of you [Outro] Not until the wind changes Ooh Every single memory of you Not until the wind changesEmbed	6
I am stunned and I am broken and my head is in my hand For she who said she love me will not wed an Indian man My Gods who were wild ridden stand quiet by my side For although I loved her she would not be my bride Oh goodbye softly sweet one it was splendid while it ran Goodbye, my bitter white girl, I'll forget you if I can She came up to the pueblo with her bright blonde hair They told me not to love her but I did not care She took me to her parties, she carried me around And I was a proud one, the tallest man in town For I found great wonder all wrapped in brilliant dreams I held her strong but gentle as kings have held their queens I learned to drink strong whiskey as she took me here and there Until life without my whiskey, I could not bear Oh goodbye softly sweet one it was splendid while it ran Goodbye, my bitter white girl, I'll forget you if I can Well when she came to leave me she took me by the arm And she said she loved me and would not do me harm But she would not marry not an Indian she said She thanked me for my offer and I wished that I was dead Now I'm back among my people and they are kind to me Although I'm sad with staggers when I drink that tough whiskey For I've been a white girl's pet, a captive Indian Shown off and discarded just a drunk who might have been You might also like Oh goodbye softly sweet one it was splendid while it ran Goodbye, my bitter white girl, I'll forget you if I canEmbed	6
Now, I will tell you, buster, that I ain't a fan of Custer's And the General, he don't ride well anymore To some, he was a hero, but to me, his score was zero And the General, he don't ride well anymore Now, Custer done his fighting without too much exciting And the General, he don't ride well anymore General Custer come in pumping when the men were out a-hunting But the General, he don't ride well anymore With victories he was swimming: he killed children, dogs, and women But the General, he don't ride well anymore Crazy Horse sent out the call to Sitting Bull and Gall And the General, he don't ride well anymore Now, Custer split his men ― well, he won't do that again 'Cause the General, he don't ride well anymore Twelve thousand warriors waited, they were unanticipated And the General, he don't ride well anymore It's not called an Indian victory but a bloody massacre And the General, he don't ride well anymore There might have been more enthusing if us Indians had been losing But the General, he don't ride well anymore General George A. Custer, oh, his yellow hair had luster But the General, he don't ride well anymore For now the General's silent, he got barbered violent And the General, he can't ride well anymore Oh, the General, he don't ride well anymoreYou might also likeEmbed	6
