text	label
Mother, mother There's too many of you crying And brother, brother, brother There's far too many of you dying You know you've got to find a way To bring back love here today Father, father There's no need to escalate Listen, war is not the answer For only love can conquer hate You know we've got to find a way To bring back love back here today Picket lines and picket signs Don't punish me with brutality And just talk to me, so you can see Oh, what's going on, what's going on What's going on, what's going on Mother, mother Every body thinks we're wrong Oh, who are they to judge us Just because our hair is long You might also likeYou know we've got to find a way To bring back understanding today You know we've got to find a way And bring back some love back here today Picket lines and picket signs Don't punish me with brutality And just talk to me, so you can see Oh, what's going on, what's going on What's going on, I tell you what's going on Oh, what's going on, what's going on What's going on, what's going on Mother, mother Father, father Good GodEmbed	1
Along from night to night you'll find me To weak to break the chains that bind me I need no shackles to remind me That I'm just a prisoner of love For one command, I stand and wait now From one who's master of my fate now I can't escape for it's to late now That I'm just a prisoner of love What's so good of my caring When someone is sharing These arms with me Although he has another I can't have another for I'm, I'm not free He's in my dreams awake or sleeping, uhm Up on my knees to him I'm creeping, oh yeah, yeah My very soul is in his keeping I'm just a prisoner of loveYou might also likeEmbed	1
Honey dear, want you near Just turn out the lights and then come over here! Nestle close, up to my side My heart's afire, with love's desire In my arms, rest complete I never thought that life could ever be so sweet 'Til I met you, some time ago But now you know I love you so! Oh, you beautiful doll! You great, big, beautiful doll! Let me put my arms about you I could never live without you Oh, you beautiful doll! You great, big, beautiful doll! If you ever leave me how my heart would ache I want to hug you but I fear you'd break Oh, Oh, Oh, Oh Oh, You Beautiful Doll! Precious prize, close your eyes Now we're goin' to visit lover's paradise Press your lips Again to mine For love is king of ev'rything Squeeze me dear, I don't care! Hug me just as if you were a grizzly bear This is how I'll go through life No care or strife, when you're my wife... You might also likeOh, you beautiful doll! You great, big, beautiful doll! Let me put my arms about you I could never live without you Oh, you beautiful doll! You great, big, beautiful doll! If you ever leave me how my heart would ache I want to hug you but I fear you'd break Oh, Oh, Oh, Oh Oh, You Beautiful Doll!Embed	2
I have tried to make you love me I've done everything your way And I'm crying for the words you'll never say You think love is an illusion That must end in sad conclusion If that's what you feel that's just how it will be And I can't grow peaches on a cherry tree When I see the peaches blossom I'll regret I said goodbye I remember cherry kisses and I'll cry But I can't go on pretending That our love is never ending For you can't be loved unless you want to be And I can't grow peaches on a cherry tree Someday I will find a new love But for you there can be no love For you can't be loved unless you want to be And I can't grow peaches on a cherry tree La La La La La La La La La La La La La La La LaYou might also likeEmbed	2
When the sky is a bright canary yellow I forget every cloud I've ever seen So they call me a cockeyed optimist Immature and incurably green I have heard people rant and rave and bellow That we're done and we might as well be dead But I'm only a cockeyed optimist And I can't get it into my head I hear the human race is falling on its face And hasn't very far to go But every whippoorwill is selling me a bill And telling me it just ain't so I could say lifе is just a bowl of Jello And appear more intеlligent and smart But I'm stuck like a dope with a thing called hope And I can't get it out of my heart Not this heartYou might also likeEmbed	2
I like it here where I am Leaving everyone be Doing the things that I do Just being plain old me Here in my own little nest I find contentment and rest Happy as I can be Just being plain old me You never hear me crying Cause I can't reach the sun You never see me trying To change places with anyone Cause I like it here where I am Leaving everyone be Loving the one I love Just being plain old me Yeah, Billy You're never hear me crying Because I can't reach the sun You'll never see me trying To change places with anyone You might also like Cause I like it here where I am Minding my own business and leaving everyone be Loving the one I love Just being plain old meEmbed	2
[Verse ] I'm telling you things I've never told to anyone before You see I, I never knew the definition of love Unconditional love You're giving me things I never got anywhere before Before you, I never knew the definition of love Unconditional love Oh love [Hook] Making it easy Making it feel so good Making it easy Making it understood Everything's right (tonight, tonight, tonight) [Refrain] I wanna do things I've never done with anyone before Until you, I never knew the definition of love Unconditional love [Instrumental] Before you, I never knew Unconditional love Unconditional love Oh, love You might also like[Hook] Making it easy Making it feel so good Making it easy Making it understood Everything's right (tonight, tonight, tonight) (tonight, tonight, tonight) [Refrain] I wanna do things I've never done with anyone before Until you, I never knew I'm getting through, I never knew I'm telling you, I never knew the definition of love Love Unconditional loveEmbed	2
I know you're leavin' babe Goodbye, so long I hope someday somebody Listens to your song Those bright lights never ever Spell your name it's true Maybe a change of scene Will be the best for you So long babe, so long babe So long babe, so long babe So long babe I know you're leavin' babe Goodbye, so long Pick up the pieces And go back where you belong You gave them all you had And what did they give you? Well they gave you nothin' babe So give 'em nothin' too So long babe, so long babe, so long babe So long babe, so long babe, so long babe So long babe You might also likeI know you're leavin' babe Goodbye and so long You never made it babe I wonder what went wrong They never understood your songs Here's what you do Just walk away and leave 'em And let 'em come to you So long babe, so long babe Yeah so long babe, so long babe So long babe, so long babe So long babe So long babe Ah so long babe So long babe Mmm So long babeEmbed	2
Ain't no sunshine when he's gone It's not warm when he's away Ain't no sunshine when he's gone And he's always gone too long Anytime he goes away I wonder this time where he's gone I wonder if he's gone to stay 'Cause there ain't no sunshine when he's gone And this house just ain't no home Anytime he goes away I know, I know, I know, I know I know, I know, I know, I know I know, I know, I know, I know I know, I know, I know, I know I know, I know, I know, I know I know, I know, I know, I know Well, I oughtta leave that man alone But there ain't no sunshine when he's gone There ain't no sunshine when he's gone There's only darkness every day Oh, there ain't no sunshine when he's gone And he's always gone too long Anytime he goes away You might also likeAnytime he goes away Anytime he goes away Anytime he goes awayEmbed	2
Mothers lock your daughters in It's too late to talk to them 'Cause Tony Rome is out and about And Tony Rome'll get 'em If you don't watch out Tony Rome'll get 'em If you don't watch out Pussycats out run a stray He will bring them back today Cause Tony Rome is out and about And Tony Rome'll find 'em If you don't watch out Tony Rome'll find 'em If you don't watch out Love is for those who have the time to Rome is for those who are inclined to Ladies' hearts adore diamond rings Are not the very special things When Tony Rome is out and about 'Cause Tony Rome'll take 'em If you don't watch out Tony Rome'll take 'em If you don't watch out You might also likeLove is for those who have the time to And Rome is for those who are inclined to Ladies' hearts adore diamond rings Are not the very special things When Tony Rome is out yeah and about 'Cause Tony Rome'll grab 'em If you don't watch out Tony Rome'll take 'em If you don't watch out Watch out!Embed	2
All the leaves are brown All the leaves are brown And the sky is grey And the sky is grey I've been for a walk I've been for a walk On a winter's day On a winter's day I'd be safe and warm I'd be safe and warm If I was in l.a If I was in l.a California dreamin' California dreamin' On such a winter's day Stopped into a church I passed along the way Well, I got down on my knees Got down on my knees And I pretend to pray I pretend to pray You know the preacher likes the cold Preacher likes the cold He knows I'm gonna stay You might also likeKnows I'm gonna stay California dreamin' California dreamin' On such a winter's day All the leaves are brown All the leaves are brown And the sky is grey And the sky is grey I've been for a walk I've been for a walk On a winter's day On a winter's day If I didn't tell her If I didn't tell her I could leave today I could leave today California dreamin' California dreamin' On such a winter's day California dreaming' On such a winter's day California dreaming' On such a winter's dayEmbed	2
Tell ya 'bout Machine Gun Kelly He road along the outlaw trails Machine Gun Kelly was a simple man But his woman was as hard as nails Watch out Machine Gun Don't let her run you round Don't let a woman put you six feet in the ground Machine Gun Tell ya 'bout Kathryn Kelly Tired about bein' small time now Figured they'd kidnap a rich man's son Make it in the world of crime Watch out Machine Gun Don't let her run you round Don't let a woman put you six feet in the ground Machine Gun Better watch out Machine Gun Kelly Careful of what'cha do now If you keep listening to your old lady No tellin' what will happen to you now Machine Gun You might also likeThe government boys who came for Machine Gun Took the poor boy away They stuck him in a hole in Leavenworth Prison Where her lived til his dying day Watch out Machine Gun Don't let her run you down Don't let a woman put you six feet in the ground Machine Gun Hey watch out Machine Gun Kelly Careful of what'cha do now If you keep listening to your old lady Ain't no tellin' what'll happen to you now Machine Gun Watch out Machine GunEmbed	2
You know I don't wanna love you but I keep coming back, yeah You know I'm hooked to you honey but you're making no tracks, uh uh Well you're the only man with a chain to my soul I keep trying to break it's only making me old I can't blank you out, I'm nearly drowning in wine, I keep a-coming back to love ya just a one more time One more You know I see you every morning when I open my eyes I don't need to hear ya talking cause I know it's all lies anyway, yeah it is You know my daddy is a man but he never gets strange, every time I turn around you're pulling some fast change on me Yes you are I can't stand it, hell, I'm going out of my mind I keep a-coming back to love ya just a one more time One more You know I don't wanna see you, never go to your place no oh I don't wanna let you see me, gonna cover up my face uh huh You're like a magnet man all made of tin I keep trying to get away you keep pulling me in again, yes you are You might also like I can't stand it, hell, I'm going out of my mind I keep a-coming back to love ya just a one more time One more Baby one more Maybe two moreEmbed	2
I can see clearly now the rain has gone I can see all obstacles in my way Gone are the dark clouds that had me blind I can see clearly now the rain has gone I can see all obstacles in my way Gone are the dark clouds that had me blind It's gonna be a bright bright sunshiny day It's gonna be a bright bright sunshiny day I think I can make it now the pain is gone All of the bad feelings have disappeared You are the rainbow I've been waiting for You make it a bright bright sunshiny day It's gonna be a bright bright sunshiny day Look all around, there's nothing but blue skies Just look straight ahead, there's nothing but blue skies I can see clearly now the rain is gone I can see all obstacles in my way And you are the rainbow I've been waiting for You make it a bright bright sunshiny day It's gonna be a bright bright sunshiny dayYou might also likeEmbed	2
Hooray for Hollywood That screwy, ballyhooed Hollywood Where any office boy or young mechanic Can be a panic, with just a good looking pan And any barmaid can be a star maid If she dances with or without a fan Hooray for Hollywood Where you're terrific, if you're even good Where anyone at all from TV's Lassie To Monroe's chassis, is equally understood Go out and try your luck, you might be Donald Duck Hooray for Hollywood Hooray for Hollywood That phony, super coney Hollywood They come from Chillicothes and Padukahs With their bazookas to get their names up in lights All armed with photos from local rotos With their hair in ribbons and legs in tights Hooray for Hollywood You may be homely in your neighborhood But if you think that you can an actor See Mr. Factor, he'd make a monkey look good Within a half an hour, you'll look like Tyrone Power Hooray for HollywoodYou might also likeEmbed	2
There's no need to lie Without me half trying, I could love you It shows in your eyes That you feel the same way I do But wherever I go, my conscience goes What more can I say It's only desire, not yet a fire Let's keep it that way 'Cause I don't want to have to tell him a lie When I get back home 'Cause it would tear apart his fairy tale world If I did him wrong And lying to him would hurt me more Than leaving you this way So before we forget, we're not cheaters yet Let's keep it that way Let's finish this wine 'Cause I'm not thinking too clearly tonight And the touch of your hand Makes it so hard for me to tell wrong from right He waits at home, he's there alone And though I'd like to stay Before I give in, let's call it just friends And keep it that way You might also like'Cause I don't want to have to tell him a lie When I get back home 'Cause it would tear apart his fairy tale world If I did him wrong And lying to him would hurt me more Than leaving you this way So before we forget, we're not cheaters yet Let's keep it that way 'Cause I don't want to have to tell him a lie When I get back home 'Cause it would tear apart his fairy tale world If I did him wrongEmbed	2
Hey sinner, you better hear what I'm saying Sinner, you been a swinging and not praying One day of praying and six nights of fun The odds of going to heaven, six to one You walk on the wild side The devil is waiting, he's waiting to take your hand You walk on the wild side You're walking with Satan, walking on the Promise Land One day of praying and six nights of fun The odds against going to heaven, six to one You better cross over, you better walk humble Or you're gonna stumble, and Satan is waiting to take your hand You walk on the wild side You walk on the wild side Away from the Promise Land One day of praying and six nights of fun Makes he odds against going to heaven six to one You better cross over, you better walk humble Or you're gonna stumble, and Satan is waiting to take your hand You walk on the wild side You walk on the wild side You walk on the wild side You walk on the wild side You walk on the wild side You walk on the wild side You walk on the wild side You walk on the wild side You walk on the wild sideYou might also likeEmbed	2
Gone is the romance, that was so divine It's broken and can not be mended You must go your way, and I must go mine But now that our love dreams have ended What will I do? When you are far away And I am blue What'll I do? What'll I do? When I am wondrin' who Who's kissing you What'll I do? What'll I do with just a photograph To tell my little troubles to? When I'm alone Alone with only dreams of you That can't come true What'll I do? When I'm all alone Alone with only dreams of you Dreams that will never come true What'll I do?You might also likeEmbed	2
Well, East coast girls are hip I really dig those styles they wear And the Southern girls with the way they talk They knock me out when I'm down there The Midwest farmer's daughters They all make you feel alright And the Northern girls with the way they kiss They keep their boyfriends warm at night I wish they all could be California I wish they all could be California I wish they all could be California girls The West coast has the sunshine And the girls all get so tanned I dig a French bikini on Hawaii island I'm lost by a palm tree in the sand I been all around this great big world And I've seen all kinds of girls Yeah, but I couldn't wait to get back in the states Back to the cutest girls in the world I wish they all could be California I wish they all could be California I wish they all could be California girls You might also likeI wish they all could be California I wish they all could be California I wish they all could be California I wish they all could be California girlsEmbed	2
It's such a pretty world today, look at the sunshine (Look at the sunshine) And every day's the same since I met you It's such a pretty world today, knowing that you're mine (Knowing that you're mine) And happiness is being close to you And though the rain may fall our skies will all be blue If I look close enough the sun will come shining through It's such a pretty world today look at the sunshine (Look at the sunshine) Today and every day since I met you It's such a pretty world today, look at the sunshine (Look at the sunshine) And every day's the same since I met you It's such a pretty world today, knowing that you're mine (Knowing that you're mine) And happiness is being close to you And though the rain may fall my skies will all be blue If I look close enough the sun will come shining through You might also likeIt's such a pretty world today, look at the sunshine (Look at the sunshine) Today and every day since I met youEmbed	2
Wishin' and hopin' and thinkin' and prayin' Plannin' and dreamin' each night of his charms That won't get you into his arms So if you're looking to find love you can share All you gotta do is hold him And kiss him and love him And show him that you care Show him that you care just for him Do the things he likes to do Wear your hair just for him Girl, you won't get him wishin' and a-hopin' Thinkin' and a-prayin' Just wishin' and hopin' and thinkin' and prayin' Plannin' and dreamin' his kisses will start That won't get you into his heart So if you're thinkin' of havin' true lovin' All you've gotta do is hold him and kiss him And squeeze him and love him Do it, and after you do you will be hisYou might also likeEmbed	2
I touch your hand And my arms grow strong Like a pair of birds That burst with song My eyes look down At your lovely face And I hold the world In my embrace Younger than springtime are you Softer than starlight are you; Warmer than winds of June are the gentle lips you gave me Gayer than laughter are you Sweeter than music are you; Angel and lover, heaven and earth Are you to me And when your youth and joy invade my arms And fill my heart, as now they do Then younger than springtime am I Gayer than laughter am I Angel and lover, heaven and earth Am I with youYou might also likeEmbed	2
When I look in your eyes I see the wisdom of the world in your eyes I see the sadness of a thousand goodbyes When I look in your eyes I see the wisdom of the world in your eyes I see the sadness of a thousand goodbyes When I look in your eyes And it is no surprise To see the softness of the moon in your eyes And the gentle sparkle of the stars in the skies When I look in your eyes In your eyes I see the deepness of the sea I see the deepness of the love The love I feel you feel for me Autumn comes, summer dies I see the passing of the years in your eyes And when we part there'll be no tears, no goodbyes I'll just look into your eyes Those eyes, so wise So warm, so real How I love the world your eyes revealYou might also likeEmbed	2
There's lightning flashing in my mirror Thunders' rolling up behind Big grey clouds are full of Full of tears to make me blind I can't let his memory catch me I can't stop to cry alone I'm just running down a highway One jump ahead of the storm One jump ahead of the crying One jump ahead of his cold, deceiving eyes One jump ahead of his lying One jump ahead of the storm One day I looked on the horizon I saw his love just wouldn't last Before my mind was torn to pieces I had to leave and get out fast And so I slicked out of his power I saw my chance and got me gone Before the rain could start to falling One jump ahead of the storm You might also like One jump ahead of the crying One jump ahead of his cold, deceiving arms One jump ahead of his lying One jump ahead of the storm One jump ahead of the storm One jump ahead of the storm One jump ahead of the storm One jump ahead of the storm One jump ahead of the storm One jump ahead of the stormEmbed	2
Papa died leaving me and Mama alone Didn't starve, but we were relatively on our own Mama bought us a house high upon the hill In the outskirts overlooking Mobile Friday night mama's friends climbed up our hill Clever men, big business men from Mobile They call me over and they touch my yellow hair My mama look at them, she'd say don't you dare I remember when the morning came Mama cryin' in the morning rain Because they called hеr by a funny name Annabell of Mobile I'd go to bеd and mama would always tuck me in She'd kiss my eyes and tell me that she'd see me in the morning Then I'd hear the laughter from another room As I fell asleep beneath an Alabama moon Fell in love with a boy, took him home so mama could meet him He caught onto mama right away and he couldn't believe it 'Cause I didn't know she took him inside and she said If you really love her don't tell her what I am till I'm dead I remember when the morning came Mama cryin' in the morning rain Because they called her by a funny name Annabell of Mobile You might also likeOne night the light didn't burn so bright on the hill You see I knew what mama was and I loved her still And the laughter in the rooms are gone for evermore from the hill There's a lot of lonely men tonight all over mobile I remember when the morning came I was cryin' in the morning rain My mama's gotta know I'm not ashamed Of Annabell of Mobile My mamaEmbed	2
I've seen the Golden Gate at San Francisco Bay I've seen the Empire State and walked down old Broadway I've seen those Northern Lights in some Alaskan town Since I saw you with her I move, I move around I've seen a movie star at Hollywood and Vine I've seen the Zanzibar and heard the Big Ben chime I've seen the Eiffel and I've been in new Cape Town Since I saw you with her I move, yeah, I move around I've seen a matador in Barcelona cry I've seen old Singapore, the bridge on River Kwai I've seen the Mardi Gras and been in one-horse towns Since I saw you with her I move, Baby I move around I keep movin' around I keep on movin' aroundYou might also likeEmbed	2
Ooh, people, won't you leave my dog alone People, won't you leave my dog alone All he ever did was wag his tail People why did you have To throw my dog in jail ? People, won't you leave my dog alone Hey, people, won't you leave my cat alone People, won't you leave my cat alone He never said a bad word No, not him ! Why to throw him in the river People, he can't swim Ooh! People, won't you leave my cat alone Now, people, won't you leave this girl alone I said, people, won't you leave this girl alone I know exactly where it's at for me Just let me be the way I wanna be, yea People, won't you leave this girl aloneYou might also likeEmbed	2
Going to a party meet me on after-school Yeah we're going to a place where the jive is really cool And if the band stops playing there's a jukebox in the hall I got my blue dress on and my folks are gone and we're gonna have a ball So get that real guitar boy shaken He's a California man Dance right on till the floors are breaking He's a California man Well he rocks his mama so bad My baby, he's making me mad And he don't care if my legs start aching 'Cause he's a California man Well my legs start to shiver when I hear him call my name And my knees keep a knocking and his bow tie is busting out His feet start to fly and his jeans slung way down low And when he's tapping his heels it's making him feel like the king of Rock n' Roll So get that real guitar boy shaken He's a California man Dance right on till the floors are breaking He's a California man Well he rocks his mama so bad My baby, he's making me mad So he don't care if my legs start aching 'Cause he's a California man Yeah, he's my California man You might also likeGo, baby, go, baby, go, baby, go Well we're going to a party meet me on after-school You know we're going to a place where the jive is really cool And if the band stops playing there's a jukebox down the hall I got my blue dress on and my folks are gone and we're gonna have a ball So get that real guitar boy shaken He's a California man Dance right on till the floors are breaking He's a California man Well he rocks his mama so bad My baby, he's making me mad And he don't care if my legs start aching 'Cause he's a California man Yeah, he's my California manEmbed	2
